[
  {
    "adres": "Johan Huizingalaan 400 1066 JS Amsterdam",
    "straat": "Johan Huizingalaan 400",
    "postcode": "1066JS",
    "plaatsnaam": "Amsterdam",
    "lat": "52.3402325",
    "lon": "4.8264244",
    "osm_id": "2808307759",
    "publicaties": "met ingang van 25 mei 2020 inzake (F.13/15/146) MEXX LIFESTYLE B.V., vest.adr. Johan Huizingalaan 400, 1066 JS Amsterdam, KvK 53592174.<hr>met ingang van 25 mei 2020 inzake (F.13/14/663) MEXX HOLDING NETHERLANDS B.V., vest.adr. Johan Huizingalaan 400, 1066 JS Amsterdam, corr.adr. Postbus 90092, 1006 BB Amsterdam, KvK 28048659, hodn MEXX LIFESTYLE STORE, vest.adr. Aankomstpassage 28, 1118 AX Schiphol; MEXX FAMILY STORE, vest.adr. Wolfstraat 18, 6211 GN Maastricht; MEXX LIFESTYLE STORE, vest.adr. Langestraat 44 46, 3811 AH Amersfoort; MEXX LIFESTYLE STORE, vest.adr. Ketelstraat 14, 6811 CX Arnhem; MEXX LIFESTYLE STORE, vest.adr. Oudegracht 129, 3511 AH Utrecht; MEXX MEGASTORE, vest.adr. Minckelersstraat 3, 6211 GX Maastricht; MEXX FAMILY STORE DEN HAAG, vest.adr. Wagenstraat 14, 2512 AX 's-Gravenhage; MEXX FAMILY STORE, vest.adr. Barteljorisstraat 13 17, 2011 RA Haarlem; MEXX LIFESTYLE STORE, vest.adr. Pr Johan Friso Promenade 115, 2284 DE Rijswijk; MEXX FAMILY STORE, vest.adr. Hoofdstraat 120 B, 7311 KJ Apeldoorn; MEXX STORE, vest.adr. Wolfstraat 20, 6211 GN Maastricht; MEXX STORE, vest.adr. Marikenstraat 37, 6511 PX Nijmegen; MEXX STORE, vest.adr. Willem II Straat 65, 5038 BD Tilburg; MEXX LIFESTYLE STORE, vest.adr. Hooge Steenweg 15, 5211 JN 's-Hertogenbosch.\nmet ingang van 25 mei 2020 inzake (F.13/14/671) MEXX EUROPRODUCTION B.V., vest.adr. Johan Huizingalaan 400, 1066 JS Amsterdam, corr.adr. Postbus 90092, 1006 BB Amsterdam, KvK 28054654.",
    "kvk": [
      "53592174",
      "28054654"
    ],
    "datum": "2020-05-25"
  },
  {
    "adres": "Hooge Steenweg 15 5211 JN 's-Hertogenbosch",
    "straat": "Hooge Steenweg 15",
    "postcode": "5211JN",
    "plaatsnaam": "'s-Hertogenbosch",
    "lat": "51.6901138",
    "lon": "5.3020216",
    "osm_id": "2738311732",
    "publicaties": "met ingang van 25 mei 2020 inzake (F.13/14/663) MEXX HOLDING NETHERLANDS B.V., vest.adr. Johan Huizingalaan 400, 1066 JS Amsterdam, corr.adr. Postbus 90092, 1006 BB Amsterdam, KvK 28048659, hodn MEXX LIFESTYLE STORE, vest.adr. Aankomstpassage 28, 1118 AX Schiphol; MEXX FAMILY STORE, vest.adr. Wolfstraat 18, 6211 GN Maastricht; MEXX LIFESTYLE STORE, vest.adr. Langestraat 44 46, 3811 AH Amersfoort; MEXX LIFESTYLE STORE, vest.adr. Ketelstraat 14, 6811 CX Arnhem; MEXX LIFESTYLE STORE, vest.adr. Oudegracht 129, 3511 AH Utrecht; MEXX MEGASTORE, vest.adr. Minckelersstraat 3, 6211 GX Maastricht; MEXX FAMILY STORE DEN HAAG, vest.adr. Wagenstraat 14, 2512 AX 's-Gravenhage; MEXX FAMILY STORE, vest.adr. Barteljorisstraat 13 17, 2011 RA Haarlem; MEXX LIFESTYLE STORE, vest.adr. Pr Johan Friso Promenade 115, 2284 DE Rijswijk; MEXX FAMILY STORE, vest.adr. Hoofdstraat 120 B, 7311 KJ Apeldoorn; MEXX STORE, vest.adr. Wolfstraat 20, 6211 GN Maastricht; MEXX STORE, vest.adr. Marikenstraat 37, 6511 PX Nijmegen; MEXX STORE, vest.adr. Willem II Straat 65, 5038 BD Tilburg; MEXX LIFESTYLE STORE, vest.adr. Hooge Steenweg 15, 5211 JN 's-Hertogenbosch.\nmet ingang van 25 mei 2020 inzake (F.13/14/671) MEXX EUROPRODUCTION B.V., vest.adr. Johan Huizingalaan 400, 1066 JS Amsterdam, corr.adr. Postbus 90092, 1006 BB Amsterdam, KvK 28054654.",
    "kvk": [
      "28048659",
      "28054654"
    ],
    "datum": "2020-05-25"
  },
  {
    "adres": "Diepenbrockstraat 265 2625XM Delft",
    "straat": "Diepenbrockstraat 265",
    "postcode": "2625XM",
    "plaatsnaam": "Delft",
    "lat": "51.9948682",
    "lon": "4.3466533",
    "osm_id": "2595412472",
    "publicaties": "Door verbindende uitdelingslijst op 01 mei 2020 inzake (F.09/17/140) Jašar Durmiši, woonadr. Diepenbrockstraat 265 2625XM Delft, geb. Priština 18 september 1956. hodn Schoonmaakbedrijf Sinber vest.adr. Diepenbrockstraat 265 2625XM Delft, KvK: 50307894.\nDoor verbindende uitdelingslijst op 01 mei 2020 inzake (F.09/19/141) ASSIST archiefverzorging gouda B.V, vest.adr. Houtenstraat 5 2801WD Gouda, KvK: 24322410 hodn ASSIST archiefverzorging gouda B.V. corr.adr. Houtenstraat 5 2801WD Gouda, vest.adr. Houtenstraat 5 2801WD Gouda.",
    "kvk": [
      "50307894",
      "24322410"
    ],
    "datum": "2020-05-01"
  },
  {
    "adres": "Houtenstraat 5 2801WD Gouda",
    "straat": "Houtenstraat 5",
    "postcode": "2801WD",
    "plaatsnaam": "Gouda",
    "lat": "52.0075467",
    "lon": "4.7096277",
    "osm_id": "2787986509",
    "publicaties": "Door verbindende uitdelingslijst op 01 mei 2020 inzake (F.09/17/140) Jašar Durmiši, woonadr. Diepenbrockstraat 265 2625XM Delft, geb. Priština 18 september 1956. hodn Schoonmaakbedrijf Sinber vest.adr. Diepenbrockstraat 265 2625XM Delft, KvK: 50307894.\nDoor verbindende uitdelingslijst op 01 mei 2020 inzake (F.09/19/141) ASSIST archiefverzorging gouda B.V, vest.adr. Houtenstraat 5 2801WD Gouda, KvK: 24322410 hodn ASSIST archiefverzorging gouda B.V. corr.adr. Houtenstraat 5 2801WD Gouda, vest.adr. Houtenstraat 5 2801WD Gouda.",
    "kvk": [
      "50307894",
      "24322410"
    ],
    "datum": "2020-05-01"
  },
  {
    "adres": "Zaagmolenpad 101 7008AH Doetinchem",
    "straat": "Zaagmolenpad 101",
    "postcode": "7008AH",
    "plaatsnaam": "Doetinchem",
    "lat": "51.9720143",
    "lon": "6.2676724",
    "osm_id": "2669411595",
    "publicaties": "Uitspraak faillissement op 01 mei 2020 inzake (F.05/20/160) Rutgers Milieu B.V, vest.adr. Mercuriusstraat 36 7006RL Doetinchem, vest.adr. Zaagmolenpad 101 7008AH Doetinchem, KvK: 55437877 hodn Rutgers Milieu B.V. corr.adr. Mercuriusstraat 36 7006RL Doetinchem, vest.adr. Mercuriusstraat 36 7006RL Doetinchem, vest.adr. Zaagmolenpad 101 7008AH Doetinchem. Cur: mr V.F.M. Jongerius, Postbus 218 7000AE DOETINCHEM tel. 0314-375500. RC: mr. E Boerwinkel.\nUitspraak faillissement op 01 mei 2020 inzake (F.05/20/161) MTT Tractors B.V, vest.adr. Westervoortsedijk 73 GE 6827AV Arnhem, KvK: 70634785 hodn MTT Tractors B.V. corr.adr. Postbus 882 6800AW ARNHEM, vest.adr. Westervoortsedijk 73 GE 6827AV Arnhem, hodn Soil Care Company corr.adr. Postbus 882 6800AW ARNHEM, vest.adr. Westervoortsedijk 73 GE 6827AV Arnhem, hodn MTT corr.adr. Postbus 882 6800AW ARNHEM, vest.adr. Westervoortsedijk 73 GE 6827AV Arnhem, hodn Van Ham Innovatie & Ontwikkeling corr.adr. Postbus 882 6800AW ARNHEM, vest.adr. Westervoortsedijk 73 GE 6827AV Arnhem, hodn MultiToolTrac corr.adr. Postbus 882 6800AW ARNHEM, vest.adr. Westervoortsedijk 73 GE 6827AV Arnhem. Cur: mr C.A.M. Nijhuis, Postbus 9.220 6800KA ARNHEM tel. 088-7520000. RC: mr. Schippers.",
    "kvk": [
      "55437877",
      "70634785"
    ],
    "datum": "2020-05-01"
  },
  {
    "adres": "Riezebosweg 13 8171MG Vaassen",
    "straat": "Riezebosweg 13",
    "postcode": "8171MG",
    "plaatsnaam": "Vaassen",
    "lat": "52.2976066",
    "lon": "5.9894041",
    "osm_id": "2882220889",
    "publicaties": "(F.05/17/436), Get Up Benelux B.V, vest.adr. Riezebosweg 13 8171MG Vaassen, KvK: 59672277 hodn Get Up Nederland, hodn Get Up België, hodn Get Up Luxemburg, hodn Get Up Huisliften, hodn Get Up Goederenliften, hodn Get Up Keukenliften, hodn Get Up Heftafel, hodn Get Up Montage, hodn Get Up De-montage, hodn Get Up Mindervalide liften, hodn Get Up Domus liften, hodn Get Up Montala liften, hodn Get Up Thorax liften, hodn Get Up Handels onderneming, hodn Get Up liften. Cur: mr J.B.A. Jansen, Postbus 695 7300AR APELDOORN tel. 055-5262020. RC: mr. E Boerwinkel.\n(F.05/17/534), AV Lease B.V, vest.adr. Constant Permekehof 9 1328AL Almere, KvK: 08021435 hodn Inter*software Compuconnection vest.adr. Constant Permekehof 9 1328AL Almere, hodn INTER*SOFTWARE C.C. vest.adr. Constant Permekehof 9 1328AL Almere. Cur: mr E.J. Kuper, Postbus 114 3840AC HARDERWIJK tel. 0341-420606. RC: mr. A.M.P.T. Blokhuis.\n(F.05/19/73), Machinefabriek Berends van Loenen B.V, vest.adr. Hoenderparkweg 70 7335GV Apeldoorn, KvK: 08037409 hodn Machinefabriek Berends van Loenen B.V. corr.adr. Hoenderparkweg 70 7335GV Apeldoorn, vest.adr. Hoenderparkweg 70 7335GV Apeldoorn. Cur: mr P. Trip, Postbus 695 7300AR APELDOORN tel. 055-5262020. RC: mr. E Boerwinkel.",
    "kvk": [
      "59672277",
      "08021435",
      "08037409"
    ],
    "datum": ""
  },
  {
    "adres": "Constant Permekehof 9 1328AL Almere",
    "straat": "Constant Permekehof 9",
    "postcode": "1328AL",
    "plaatsnaam": "Almere",
    "lat": "52.3777648",
    "lon": "5.2557588",
    "osm_id": "2842695052",
    "publicaties": "(F.05/17/436), Get Up Benelux B.V, vest.adr. Riezebosweg 13 8171MG Vaassen, KvK: 59672277 hodn Get Up Nederland, hodn Get Up België, hodn Get Up Luxemburg, hodn Get Up Huisliften, hodn Get Up Goederenliften, hodn Get Up Keukenliften, hodn Get Up Heftafel, hodn Get Up Montage, hodn Get Up De-montage, hodn Get Up Mindervalide liften, hodn Get Up Domus liften, hodn Get Up Montala liften, hodn Get Up Thorax liften, hodn Get Up Handels onderneming, hodn Get Up liften. Cur: mr J.B.A. Jansen, Postbus 695 7300AR APELDOORN tel. 055-5262020. RC: mr. E Boerwinkel.\n(F.05/17/534), AV Lease B.V, vest.adr. Constant Permekehof 9 1328AL Almere, KvK: 08021435 hodn Inter*software Compuconnection vest.adr. Constant Permekehof 9 1328AL Almere, hodn INTER*SOFTWARE C.C. vest.adr. Constant Permekehof 9 1328AL Almere. Cur: mr E.J. Kuper, Postbus 114 3840AC HARDERWIJK tel. 0341-420606. RC: mr. A.M.P.T. Blokhuis.\n(F.05/19/73), Machinefabriek Berends van Loenen B.V, vest.adr. Hoenderparkweg 70 7335GV Apeldoorn, KvK: 08037409 hodn Machinefabriek Berends van Loenen B.V. corr.adr. Hoenderparkweg 70 7335GV Apeldoorn, vest.adr. Hoenderparkweg 70 7335GV Apeldoorn. Cur: mr P. Trip, Postbus 695 7300AR APELDOORN tel. 055-5262020. RC: mr. E Boerwinkel.",
    "kvk": [
      "59672277",
      "08021435",
      "08037409"
    ],
    "datum": ""
  },
  {
    "adres": "Hoenderparkweg 70 7335GV Apeldoorn",
    "straat": "Hoenderparkweg 70",
    "postcode": "7335GV",
    "plaatsnaam": "Apeldoorn",
    "lat": "52.1954069",
    "lon": "5.9520867",
    "osm_id": "2686707354",
    "publicaties": "(F.05/17/436), Get Up Benelux B.V, vest.adr. Riezebosweg 13 8171MG Vaassen, KvK: 59672277 hodn Get Up Nederland, hodn Get Up België, hodn Get Up Luxemburg, hodn Get Up Huisliften, hodn Get Up Goederenliften, hodn Get Up Keukenliften, hodn Get Up Heftafel, hodn Get Up Montage, hodn Get Up De-montage, hodn Get Up Mindervalide liften, hodn Get Up Domus liften, hodn Get Up Montala liften, hodn Get Up Thorax liften, hodn Get Up Handels onderneming, hodn Get Up liften. Cur: mr J.B.A. Jansen, Postbus 695 7300AR APELDOORN tel. 055-5262020. RC: mr. E Boerwinkel.\n(F.05/17/534), AV Lease B.V, vest.adr. Constant Permekehof 9 1328AL Almere, KvK: 08021435 hodn Inter*software Compuconnection vest.adr. Constant Permekehof 9 1328AL Almere, hodn INTER*SOFTWARE C.C. vest.adr. Constant Permekehof 9 1328AL Almere. Cur: mr E.J. Kuper, Postbus 114 3840AC HARDERWIJK tel. 0341-420606. RC: mr. A.M.P.T. Blokhuis.\n(F.05/19/73), Machinefabriek Berends van Loenen B.V, vest.adr. Hoenderparkweg 70 7335GV Apeldoorn, KvK: 08037409 hodn Machinefabriek Berends van Loenen B.V. corr.adr. Hoenderparkweg 70 7335GV Apeldoorn, vest.adr. Hoenderparkweg 70 7335GV Apeldoorn. Cur: mr P. Trip, Postbus 695 7300AR APELDOORN tel. 055-5262020. RC: mr. E Boerwinkel.",
    "kvk": [
      "59672277",
      "08021435",
      "08037409"
    ],
    "datum": ""
  },
  {
    "adres": "Ambachtsweg 41 6541DA Nijmegen",
    "straat": "Ambachtsweg 41",
    "postcode": "6541DA",
    "plaatsnaam": "Nijmegen",
    "lat": "51.8416668",
    "lon": "5.8156749",
    "osm_id": "2953576418",
    "publicaties": "Vernietiging faillissement na verzet op 30 april 2020 inzake (F.05/20/137) Recep Özçay, geb. Kayseri (Turkije) 10 mei 1968. hodn R&M Schadebedrijf vest.adr. Ambachtsweg 41 6541DA Nijmegen, KvK: 62633082.",
    "kvk": [
      "62633082"
    ],
    "datum": "2020-04-30"
  },
  {
    "adres": "Grote Blerickse Bergenwg 15 5927PB Venlo",
    "straat": "Grote Blerickse Bergenwg 15",
    "postcode": "5927PB",
    "plaatsnaam": "Venlo",
    "lat": "51.363357",
    "lon": "6.172851",
    "osm_id": "5295787400",
    "publicaties": "(F.04/12/249), Lydifleur B.V, vest.adr. Grote Blerickse Bergenwg 15 5927PB Venlo, KvK: 51657430. Cur: mr J.A. Bloo, Postbus 377 5900AJ VENLO tel. 077-3515041. RC: mr. BRM de Bruijn.<hr>Met ingang van 26 mei 2020 inzake (F.04/12/249) Lydifleur B.V, vest.adr. Grote Blerickse Bergenwg 15 5927PB Venlo, KvK: 51657430.",
    "kvk": [
      "51657430"
    ],
    "datum": "2020-05-26"
  },
  {
    "adres": "Weert 78 6231 SB Meerssen",
    "straat": "Weert 78",
    "postcode": "6231SB",
    "plaatsnaam": "Meerssen",
    "lat": "50.8838642",
    "lon": "5.7345352",
    "osm_id": "2821033146",
    "publicaties": "met ingang van 11 mei 2020 inzake (F.3/08/56) FAVINI NV, corr.adr. Postbus 2, 6230 AA Meerssen, vest.adr. Weert 78, 6231 SB Meerssen, KvK Limburg, 08029353, hodn FAVINI.",
    "kvk": [
      "08029353"
    ],
    "datum": "2020-05-11"
  },
  {
    "adres": "IJsselmeerweg 100 1411DL Naarden",
    "straat": "IJsselmeerweg 100",
    "postcode": "1411DL",
    "plaatsnaam": "Naarden",
    "lat": "52.3207459",
    "lon": "5.1408543",
    "osm_id": "2866149238",
    "publicaties": "Met ingang van 19 mei 2020 inzake (F.16/18/499) Naarderbos Events B.V, vest.adr. IJsselmeerweg 100 1411DL Naarden, KvK: 70854572 hodn Naarderbos Events B.V. corr.adr. IJsselmeerweg 100 1411DL Naarden, vest.adr. IJsselmeerweg 100 1411DL Naarden.",
    "kvk": [
      "70854572"
    ],
    "datum": "2020-05-19"
  },
  {
    "adres": "Graftermeerstraat 41 2131AA Hoofddorp",
    "straat": "Graftermeerstraat 41",
    "postcode": "2131AA",
    "plaatsnaam": "Hoofddorp",
    "lat": "52.3129746",
    "lon": "4.693742",
    "osm_id": "2732764890",
    "publicaties": "Uitspraak faillissement op 04 mei 2020 inzake (F.15/20/151) Aannemersbedrijf Meerbouw Hoofddorp B.V, vest.adr. Graftermeerstraat 41 2131AA Hoofddorp, KvK: 30105362 hodn Aannemersbedrijf Meerbouw Hoofddorp B.V. corr.adr. Graftermeerstraat 41 2131AA Hoofddorp, vest.adr. Graftermeerstraat 41 2131AA Hoofddorp. Cur: mr C.H. Hartsuiker, Postbus 698 2130AR HOOFDDORP tel. 023-5175100. RC: mr. M.M. Kruithof.",
    "kvk": [
      "30105362"
    ],
    "datum": "2020-05-04"
  },
  {
    "adres": "Robert Scottstraat 19 1056AW Amsterdam",
    "straat": "Robert Scottstraat 19",
    "postcode": "1056AW",
    "plaatsnaam": "Amsterdam",
    "lat": "52.3748611",
    "lon": "4.8454445",
    "osm_id": "2808695747",
    "publicaties": "Vernietiging faillissement na verzet op 04 mei 2020 inzake (F.15/20/116) Stipt in Zorg B.V, vest.adr. Robert Scottstraat 19 1056AW Amsterdam, KvK: 73366234 hodn Stipt in Zorg B.V. corr.adr. Robert Scottstraat 19 1056AW Amsterdam, vest.adr. Robert Scottstraat 19 1056AW Amsterdam.",
    "kvk": [
      "73366234"
    ],
    "datum": "2020-05-04"
  }
]